{
  "$schema": "../../../../release/schemas/v1/release-audit.schema.json",
  "schema_version": 1,
  "generated_by": "Briosa.Generator release evidence",
  "spatial_analyzer_target": "2026.1.0529.7",
  "master_epic": "https://github.com/spatialanalyzer/briosa/issues/47",
  "release_ready": false,
  "evidence_inputs": [
    {
      "path": ".github/workflows/ci.yml",
      "sha256": "a8865fa9bb60f2643d5f96fc5240ef7a6cb79606c473b1fb6217023b2b51dcec"
    },
    {
      "path": ".github/workflows/release.yml",
      "sha256": "682b0122198bb4cbf5828fbfc48b53c7ac1934734c9b47345c724b6a9857f55c"
    },
    {
      "path": "docs/architecture/0018-uncertain-completion-and-replay.md",
      "sha256": "090ab07d9ad9497262fac0293ca8c7c0783daf120f2a191e145f4d1e386b300f"
    },
    {
      "path": "docs/architecture/0019-global-state-workflow-isolation.md",
      "sha256": "ed80da086f10ae56d8a9d9c7227bd4f451485a41823ca5bd16f1b603083ed841"
    },
    {
      "path": "docs/architecture/0022-runtime-identity-and-attestation.md",
      "sha256": "868b4c2852e73ecce30783d15e40176cf6c6bad2d60235fc3a1707f8ed9d8a3c"
    },
    {
      "path": "docs/operations/command-policy-and-auditing.md",
      "sha256": "0be29b355952940f629ab5e65f8271fb50e17458de7b4af16a5c2a37df58af6c"
    },
    {
      "path": "docs/operations/licensed-sa-runner.md",
      "sha256": "5047a3f171f04565478fbac9a78f84d7c259ba9cc39a73c350b7fca0c2d7e10c"
    },
    {
      "path": "docs/security/threat-model.md",
      "sha256": "19f632670db1b57b3c477437a2027b4426d7ddddbbb842b24026b5f14413308c"
    },
    {
      "path": "docs/testing/portable-conformance.md",
      "sha256": "32dca4cb5a53b77ff2a91339666ec031536db14c790067a128d888b2982d9664"
    },
    {
      "path": "docs/testing/runtime-performance-and-soak.md",
      "sha256": "2d543ad82fe12d209d9cb49cfd4877ecaeffc1626fd2b496c7d7ecdf5c1f86f6"
    },
    {
      "path": "eng/full-surface-policy.json",
      "sha256": "bb4fc69d422d3239824b1ef34e3979d06d0cd361250b393424bea6f7ba4903ef"
    },
    {
      "path": "generated/release/sa/2026.1.0529.7/support-matrix.json",
      "sha256": "977b7fc474776149a39e11f301f532069389ec370c3aea03bf40aee95a00cd33"
    },
    {
      "path": "release/sa/2026.1.0529.7/audit-policy.json",
      "sha256": "003183ead56cc6c67ea19095b3e21181fa722c267677d0ac23673507cd106a03"
    }
  ],
  "summary": {
    "passed": 3,
    "blocked": 3,
    "not_applicable": 1
  },
  "criteria": [
    {
      "criterion_id": "epic-47-portable-conformance",
      "source": "https://github.com/spatialanalyzer/briosa/issues/47",
      "description": "Portable tests cover every cataloged operation.",
      "status": "passed",
      "evidence": [
        "generated/release/sa/2026.1.0529.7/support-matrix.json",
        "generated/conformance/sa/2026.1.0529.7/manifest.json"
      ],
      "blocker_references": []
    },
    {
      "criterion_id": "epic-47-protected-runner",
      "source": "https://github.com/spatialanalyzer/briosa/issues/47",
      "description": "The protected runner executes the approved real-SA matrix from trusted artifacts.",
      "status": "blocked",
      "evidence": [],
      "blocker_references": [
        "https://github.com/spatialanalyzer/briosa/issues/20",
        "https://github.com/spatialanalyzer/briosa/issues/69"
      ]
    },
    {
      "criterion_id": "epic-47-risk-fixtures",
      "source": "https://github.com/spatialanalyzer/briosa/issues/47",
      "description": "Mutating and device-related operations have reviewed fixtures and controls.",
      "status": "blocked",
      "evidence": [
        "collection_operations.construct_point_in_working_coordinates",
        "collection_operations.delete_points",
        "collection_operations.rename_point"
      ],
      "blocker_references": [
        "https://github.com/spatialanalyzer/briosa/issues/20",
        "https://github.com/spatialanalyzer/briosa/issues/69"
      ]
    },
    {
      "criterion_id": "epic-47-performance-and-reproducibility",
      "source": "https://github.com/spatialanalyzer/briosa/issues/47",
      "description": "Full-surface budgets and byte-reproducible package gates are configured.",
      "status": "passed",
      "evidence": [
        "eng/full-surface-policy.json",
        "eng/Test-RuntimePerformance.ps1",
        "eng/Test-WindowsPackage.ps1",
        "eng/Test-ProtocolArtifact.ps1",
        ".github/workflows/release.yml"
      ],
      "blocker_references": []
    },
    {
      "criterion_id": "epic-47-support-matrix",
      "source": "https://github.com/spatialanalyzer/briosa/issues/47",
      "description": "Every exact-target inventory command has one fail-closed classification.",
      "status": "passed",
      "evidence": [
        "generated/release/sa/2026.1.0529.7/support-matrix.json"
      ],
      "blocker_references": []
    },
    {
      "criterion_id": "issue-72-runtime-identity-validation",
      "source": "https://github.com/spatialanalyzer/briosa/issues/72",
      "description": "Exact-target runtime identity policy has protected matching and mismatch evidence.",
      "status": "blocked",
      "evidence": [],
      "blocker_references": [
        "https://github.com/spatialanalyzer/briosa/issues/70"
      ]
    },
    {
      "criterion_id": "issue-72-protocol-baselines",
      "source": "https://github.com/spatialanalyzer/briosa/issues/72",
      "description": "No immutable protocol baseline is required before the first public release.",
      "status": "not_applicable",
      "evidence": [
        "eng/full-surface-policy.json"
      ],
      "blocker_references": []
    }
  ]
}
